{
  "dataset": "d365-finops-pqu",
  "schema_version": "1.1.0",
  "generated_at": "2026-10-13T13:44:17.669863Z",
  "source": {
    "publisher": "Microsoft",
    "repository": "MicrosoftDocs/dynamics-365-unified-operations-public",
    "branch": "main",
    "file_path": "articles/fin-ops-core/dev-itpro/get-started/quality-updates-schedule.md",
    "commit": "7d86a35169692606d303c21e204ae6032d44d44e",
    "article_url": "https://learn.microsoft.com/en-us/dynamics365/fin-ops-core/dev-itpro/get-started/quality-updates-schedule",
    "raw_url": "https://raw.githubusercontent.com/MicrosoftDocs/dynamics-365-unified-operations-public/7d86a35169692606d303c21e204ae6032d44d44e/articles/fin-ops-core/dev-itpro/get-started/quality-updates-schedule.md",
    "markdown_date": "2026-10-13",
    "sha256": "8431bf5fb97becf088a0eaa4eec8f42cb7f86dcafc7f68f9d4b3d972b5cf1eb0",
    "retrieved_at": "2026-10-13T13:44:17.669863Z"
  },
  "categories": [
    {
      "id": "trains",
      "title": "Train rhythm",
      "group_label": "Version"
    },
    {
      "id": "stations",
      "title": "Station rollout",
      "group_label": "Station"
    },
    {
      "id": "service-updates",
      "title": "Service update rhythm",
      "group_label": "Service updates"
    }
  ],
  "metrics": [
    {
      "id": "train-cadence",
      "category": "trains",
      "title": "Days between train starts",
      "unit": "days",
      "statistic": "median",
      "sample_unit": "intervals",
      "sources": [
        "schedule"
      ],
      "method": "The trains of each application version are put in train-number order. For each pair of consecutive train numbers, the days between their published start dates are counted, and the figure is the median. A train whose published start date contradicts Microsoft's other published dates is left out, together with the intervals next to it.",
      "excluded": []
    },
    {
      "id": "cutoff-to-start",
      "category": "trains",
      "title": "Change cutoff to train start",
      "unit": "days",
      "statistic": "median",
      "sample_unit": "trains",
      "sources": [
        "schedule"
      ],
      "method": "For each train, the days from its published change cutoff date to its published start date. The figure is the median per application version. Trains whose published dates contradict Microsoft's other published dates are left out.",
      "excluded": []
    },
    {
      "id": "train-length",
      "category": "trains",
      "title": "Train length",
      "unit": "days",
      "statistic": "median",
      "sample_unit": "trains",
      "sources": [
        "schedule"
      ],
      "method": "Calendar days from each train's published start date to its published end date, counting both dates (the same count as “Day X of Y” on the Trains tab). The figure is the median per application version. Trains whose published dates contradict Microsoft's other published dates are left out.",
      "excluded": []
    },
    {
      "id": "trains-by-status",
      "category": "trains",
      "title": "Trains in the schedule",
      "unit": "trains",
      "statistic": "count",
      "sample_unit": null,
      "sources": [
        "schedule"
      ],
      "method": "The number of trains Microsoft lists for each application version, broken down by the status Microsoft publishes.",
      "excluded": []
    },
    {
      "id": "station-offset",
      "category": "stations",
      "title": "Sandbox start after Station 1",
      "unit": "days",
      "statistic": "median",
      "sample_unit": "trains",
      "sources": [
        "schedule"
      ],
      "method": "For each train with a detailed station schedule, the days from Station 1's sandbox start to each other station's sandbox start. The figure is the median per station. Microsoft's article only lists the most recent detailed schedules, so the sample is small.",
      "excluded": []
    },
    {
      "id": "sandbox-to-production",
      "category": "stations",
      "title": "Production start after sandbox start",
      "unit": "days",
      "statistic": "median",
      "sample_unit": "trains",
      "sources": [
        "schedule"
      ],
      "method": "For each station window with both a sandbox and a production range, the days from the sandbox start to the production start. The figure is the median per station and across all stations. Station 1 has no production range.",
      "excluded": []
    },
    {
      "id": "regions-per-station",
      "category": "stations",
      "title": "Azure regions",
      "unit": "regions",
      "statistic": "count",
      "sample_unit": null,
      "sources": [
        "schedule"
      ],
      "method": "The number of Azure regions Microsoft maps to each station.",
      "excluded": [
        {
          "item": "Station 1",
          "reason": "Only for opted-in environments"
        }
      ]
    },
    {
      "id": "service-update-interval",
      "category": "service-updates",
      "title": "Days between general availability dates",
      "unit": "days",
      "statistic": "median",
      "sample_unit": "intervals",
      "sources": [
        "service_updates"
      ],
      "method": "Service updates are put in version order. For each pair of consecutive versions, the days between their general availability dates are counted, and the figure is the median.",
      "excluded": []
    },
    {
      "id": "preview-to-ga",
      "category": "service-updates",
      "title": "Preview to general availability",
      "unit": "days",
      "statistic": "median",
      "sample_unit": "service updates",
      "sources": [
        "service_updates"
      ],
      "method": "For each service update, the days from preview availability to general availability. The figure is the median.",
      "excluded": []
    },
    {
      "id": "ga-to-first-autoupdate",
      "category": "service-updates",
      "title": "General availability to first autoupdate",
      "unit": "days",
      "statistic": "median",
      "sample_unit": "service updates",
      "sources": [
        "service_updates"
      ],
      "method": "For each service update, the days from general availability to the first production autoupdate start date. The figure is the median.",
      "excluded": []
    },
    {
      "id": "first-to-second-autoupdate",
      "category": "service-updates",
      "title": "First to second autoupdate",
      "unit": "days",
      "statistic": "median",
      "sample_unit": "service updates",
      "sources": [
        "service_updates"
      ],
      "method": "For each service update, the days from the first to the second production autoupdate start date. The figure is the median.",
      "excluded": []
    },
    {
      "id": "ga-to-end-of-service",
      "category": "service-updates",
      "title": "General availability to end of service",
      "unit": "days",
      "statistic": "median",
      "sample_unit": "service updates",
      "sources": [
        "service_updates"
      ],
      "method": "For each service update, the days from general availability to end of service. The figure is the median.",
      "excluded": []
    }
  ],
  "highlights": [
    "train-cadence:10.0.49",
    "sandbox-to-production:all",
    "service-update-interval:all"
  ],
  "count": 37,
  "records": [
    {
      "id": "train-cadence:10.0.46",
      "metric": "train-cadence",
      "group": "10.0.46",
      "label": "10.0.46",
      "value": 28,
      "unit": "days",
      "statistic": "median",
      "sample_size": 6,
      "min": 28,
      "max": 35,
      "breakdown": null,
      "excluded": [
        {
          "item": "10.0.46-PQU-1",
          "reason": "Change cutoff 2026-02-04 and train start 2025-02-09 are in different years"
        }
      ],
      "summary": "10.0.46: a new train starts every 28 days, or 4 weeks (median of 6 intervals; range 28–35 days)."
    },
    {
      "id": "train-cadence:10.0.47",
      "metric": "train-cadence",
      "group": "10.0.47",
      "label": "10.0.47",
      "value": 14,
      "unit": "days",
      "statistic": "median",
      "sample_size": 16,
      "min": 14,
      "max": 21,
      "breakdown": null,
      "excluded": [],
      "summary": "10.0.47: a new train starts every 14 days, or 2 weeks (median of 16 intervals; range 14–21 days)."
    },
    {
      "id": "train-cadence:10.0.48",
      "metric": "train-cadence",
      "group": "10.0.48",
      "label": "10.0.48",
      "value": 14,
      "unit": "days",
      "statistic": "median",
      "sample_size": 16,
      "min": 14,
      "max": 21,
      "breakdown": null,
      "excluded": [],
      "summary": "10.0.48: a new train starts every 14 days, or 2 weeks (median of 16 intervals; range 14–21 days)."
    },
    {
      "id": "train-cadence:10.0.49",
      "metric": "train-cadence",
      "group": "10.0.49",
      "label": "10.0.49",
      "value": 14,
      "unit": "days",
      "statistic": "median",
      "sample_size": 16,
      "min": 14,
      "max": 21,
      "breakdown": null,
      "excluded": [],
      "summary": "10.0.49: a new train starts every 14 days, or 2 weeks (median of 16 intervals; range 14–21 days)."
    },
    {
      "id": "cutoff-to-start:10.0.46",
      "metric": "cutoff-to-start",
      "group": "10.0.46",
      "label": "10.0.46",
      "value": 5,
      "unit": "days",
      "statistic": "median",
      "sample_size": 7,
      "min": 5,
      "max": 10,
      "breakdown": null,
      "excluded": [
        {
          "item": "10.0.46-PQU-1",
          "reason": "Change cutoff 2026-02-04 and train start 2025-02-09 are in different years"
        }
      ],
      "summary": "10.0.46: the change cutoff is 5 days before the train starts (median of 7 trains; range 5–10 days)."
    },
    {
      "id": "cutoff-to-start:10.0.47",
      "metric": "cutoff-to-start",
      "group": "10.0.47",
      "label": "10.0.47",
      "value": 0,
      "unit": "days",
      "statistic": "median",
      "sample_size": 17,